{
  "schema_version": 1,
  "kind": "policy",
  "id": "signthos-license-policy-v1",
  "policy_type": "license",
  "policy_version": 1,
  "rules": [
    {
      "id": "reject-bare-agpl-3.0",
      "effect": "reject_expression",
      "expression": "AGPL-3.0"
    },
    {
      "id": "reject-bare-gpl-2.0",
      "effect": "reject_expression",
      "expression": "GPL-2.0"
    },
    {
      "id": "reject-bare-gpl-3.0",
      "effect": "reject_expression",
      "expression": "GPL-3.0"
    },
    {
      "id": "reject-bare-lgpl-2.1",
      "effect": "reject_expression",
      "expression": "LGPL-2.1"
    },
    {
      "id": "reject-bare-lgpl-3.0",
      "effect": "reject_expression",
      "expression": "LGPL-3.0"
    }
  ]
}
